AMITA HEALTH SAINT JOSEPH MEDICAL CENTER,333 N MADISON ST,JOLIET,IL,WILL,60435,41.528248,-88.134645,"333 N MADISON ST JOLIET, IL",(815) 725-7133,Above the national average,,Below the national average,,Below the national average,,Same as the national average,,Below the national average,,Below the national average,,Same as the national average,,Yes,1,0.35,A,5,1.75,0,0,0,Y,5,0.75,3,http://www.presencehealth.org/presence-saint-joseph-medical-center-joliet
AMITA HEALTH SAINTS MARY AND ELIZABETH MEDICAL CENTER,2233 W DIVISION ST,CHICAGO,IL,COOK,60622,41.903104,-87.683213,"2233 W DIVISION ST CHICAGO, IL",(312) 770-2000,Above the national average,,Above the national average,,Below the national average,,Below the national average,,Same as the national average,,Below the national average,,Below the national average,,Yes,3,1.05,A,5,1.75,0,0,0,Y,5,0.75,4,http://www.presencehealth.org/presence-saints-mary-and-elizabeth-medical-center-chicago
ROSELAND COMMUNITY HOSPITAL,45 W 111TH STREET,CHICAGO,IL,COOK,60628,41.692562,-87.624734,"45 W 111TH STREET CHICAGO, IL",(773) 995-3000,Same as the national average,,,Results are not available for this reporting period.,Same as the national average,,Below the national average,,Below the national average,,Below the national average,,,Results are not available for this reporting period.,Yes,1,0.35,Hospital does not participate,FALSE,0,0,0,0,N,0,0,0,http://www.roselandhospital.org/
RUSH COPLEY MEDICAL CENTER,2000 OGDEN AVENUE,AURORA,IL,KANE,60504,41.727722,-88.268415,"2000 OGDEN AVENUE AURORA, IL",(630) 978-6200,Same as the national average,,Above the national average,,Above the national average,,Above the national average,,Same as the national average,,Same as the national average,,Above the national average,,Yes,5,1.75,A,5,1.75,0,0,0,N,0,0,4,https://www.rushcopley.com/
RUSH OAK PARK HOSPITAL,520 S MAPLE AVE,OAK PARK,IL,COOK,60304,41.879026,-87.803818,"520 S MAPLE AVE OAK PARK, IL",(708) 383-9300,Same as the national average,,Above the national average,,Same as the national average,,Same as the national average,,Same as the national average,,Above the national average,,Same as the national average,,Yes,4,1.4,A,5,1.75,0,0,0,Y,5,0.75,4,https://www.roph.org/
RUSH UNIVERSITY MEDICAL CENTER,1653 WEST CONGRESS PARKWAY,CHICAGO,IL,COOK,60612,41.875166,-87.66851,"1653 WEST CONGRESS PARKWAY CHICAGO, IL",(312) 942-5000,Above the national average,,Above the national average,,Below the national average,,Above the national average,,Same as the national average,,Below the national average,,Same as the national average,,Yes,5,1.75,B,4,1.4,2,5,0.75,Y,5,0.75,5,https://www.rush.edu/
SAINT ANTHONY HOSPITAL,2875 WEST 19TH STREET,CHICAGO,IL,COOK,60623,41.855538,-87.698272,"2875 WEST 19TH STREET CHICAGO, IL",(773) 521-1710,Same as the national average,,Same as the national average,,Below the national average,,Below the national average,,Same as the national average,,Below the national average,,,Results are not available for this reporting period.,Yes,2,0.7,Hospital does not participate,FALSE,0,0,0,0,N,0,0,1,https://www.sahchicago.org/
SAINT BERNARD HOSPITAL,326 W 64TH ST,CHICAGO,IL,COOK,60621,41.778114,-87.633273,"326 W 64TH ST CHICAGO, IL",(773) 962-3900,Same as the national average,,Same as the national average,,Below the national average,,Below the national average,,Same as the national average,,Below the national average,,,Results are not available for this reporting period.,Yes,1,0.35,Hospital does not participate,FALSE,0,0,0,0,N,0,0,0,https://www.stbh.org/
SILVER CROSS HOSPITAL  AND MEDICAL CENTERS,1900 SILVER CROSS BLVD,NEW LENOX,IL,WILL,60451,41.54543,-87.986049,"1900 SILVER CROSS BLVD NEW LENOX, IL",(815) 300-1100,Above the national average,,Above the national average,,Below the national average,,Above the national average,,Same as the national average,,Same as the national average,,Above the national average,,Yes,5,1.75,A,5,1.75,0,0,0,N,0,0,4,https://www.silvercross.org/
SOUTH SHORE HOSPITAL,8012 SOUTH CRANDON AVENUE,CHICAGO,IL,COOK,60617,41.749496,-87.568623,"8012 SOUTH CRANDON AVENUE CHICAGO, IL",(773) 356-5000,Same as the national average,,Same as the national average,,Below the national average,,Below the national average,,Same as the national average,,Below the national average,,,Results are not available for this reporting period.,Yes,2,0.7,F,1,0.35,0,0,0,N,0,0,1,https://www.southshorehospital.com/
SWEDISH COVENANT HOSPITAL,5145 N CALIFORNIA AVE,CHICAGO,IL,COOK,60625,41.975219,-87.698918,"5145 N CALIFORNIA AVE CHICAGO, IL",(773) 878-8200,Above the national average,,Below the national average,,Below the national average,,Same as the national average,,Same as the national average,,Same as the national average,,Same as the national average,,Yes,3,1.05,A,5,1.75,0,0,0,Y,5,0.75,4,https://swedishcovenant.org/
THOREK MEMORIAL HOSPITAL,850 W IRVING PARK RD,CHICAGO,IL,COOK,60613,41.954556,-87.650899,"850 W IRVING PARK RD CHICAGO, IL",(312) 525-6780,Same as the national average,,Same as the national average,,Below the national average,,Below the national average,,Same as the national average,,Same as the national average,,Same as the national average,,Yes,2,0.7,Hospital does not participate,FALSE,0,0,0,0,N,0,0,1,https://www.thorek.org/
UNIVERSITY OF CHICAGO MEDICAL CENTER,5841 SOUTH MARYLAND,CHICAGO,IL,COOK,60637,41.787956,-87.604925,"5841 SOUTH MARYLAND CHICAGO, IL",(773) 702-1000,Same as the national average,,Above the national average,,Below the national average,,Above the national average,,Same as the national average,,Below the national average,,Same as the national average,,Yes,3,1.05,A,5,1.75,4,5,0.75,Y,5,0.75,4,https://www.uchicagomedicine.org/
UNIVERSITY OF ILLINOIS HOSPITAL,1740 WEST TAYLOR ST,CHICAGO,IL,COOK,60612,41.869224,-87.670529,"1740 WEST TAYLOR ST SUITE 1400 CHICAGO, IL",(312) 996-3900,Same as the national average,,Below the national average,,Below the national average,,Below the national average,,Same as the national average,,Below the national average,,Same as the national average,,Yes,1,0.35,C,3,1.05,0,0,0,N,0,0,1,https://hospital.uillinois.edu/
VALLEY WEST COMMUNITY HOSPITAL,1301 NORTH MAIN STREET,SANDWICH,IL,DE KALB,60548,41.657133,-88.62192,"1301 NORTH MAIN STREET SANDWICH, IL",(815) 786-8484,Same as the national average,,,There are too few measures or measure groups reported to calculate a star rating or measure group score.,Above the national average,,Above the national average,,Same as the national average,,Above the national average,,Same as the national average,,Yes,4,1.4,Hospital does not participate,FALSE,0,0,0,0,N,0,0,1,https://www.nm.org/locations/valley-west-hospital
VISTA MEDICAL CENTER EAST,1324 NORTH SHERIDAN ROAD,WAUKEGAN,IL,LAKE,60085,42.378264,-87.830964,"1324 NORTH SHERIDAN ROAD WAUKEGAN, IL",(847) 360-3000,Same as the national average,,Same as the national average,,Below the national average,,Below the national average,,Same as the national average,,Below the national average,,Same as the national average,,Yes,2,0.7,C,3,1.05,0,0,0,N,0,0,2,http://www.vistahealth.com/vista-health-system/vista-medical-center-east.aspx
WEST SUBURBAN MEDICAL CENTER,3 ERIE COURT,OAK PARK,IL,COOK,60302,41.89184,-87.777471,"3 ERIE COURT OAK PARK, IL",(708) 383-6200,Same as the national average,,Below the national average,,Below the national average,,Below the national average,,Same as the national average,,Below the national average,,Same as the national average,,Yes,1,0.35,B,4,1.4,0,0,0,N,0,0,2,https://www.westsuburbanmc.com/
WESTLAKE COMMUNITY HOSPITAL,1225 LAKE ST,MELROSE PARK,IL,COOK,60160,41.891794,-87.848963,"1225 LAKE ST MELROSE PARK, IL",(708) 938-4000,Same as the national average,,Below the national average,,Below the national average,,Below the national average,,Same as the national average,,Same as the national average,,Same as the national average,,Yes,2,0.7,B,4,1.4,0,0,0,N,0,0,2,https://www.westlakehosp.com/